{
  "ok": true,
  "command": "doctor",
  "context_id": null,
  "result": {
    "checks": [
      {
        "name": "python",
        "status": "ok",
        "detail": "3.12.0",
        "required": true
      }
    ]
  },
  "warnings": [],
  "errors": [],
  "meta": {
    "schema_version": 1,
    "duration_ms": 4
  }
}
