{
  "ok": true,
  "command": "context.validate",
  "context_id": "example-context",
  "result": {
    "root": "/example/context",
    "issues": []
  },
  "warnings": [
    {
      "code": "CTX-ABSOLUTE-PATH",
      "message": "Use a canonical URI or relative path.",
      "path": "02_knowledge/system.md"
    }
  ],
  "errors": [],
  "meta": {
    "schema_version": 1,
    "duration_ms": 11
  }
}
